{
  "schemaVersion": "0.1.0",
  "hostId": "host_debian_12_review_packet_1776805736172_558",
  "policy": {
    "allowedSources": [
      "tailscale"
    ],
    "excludedPorts": [
      22
    ],
    "samePortMirror": false,
    "conflictPolicy": "reject",
    "backupPolicy": "required"
  },
  "bridgeRules": []
}